[
  {
    "id": "documents@1",
    "kind": "icon",
    "allowedRegions": [
      "task-list"
    ],
    "properties": [
      {
        "name": "label",
        "type": "string",
        "required": true,
        "maxLength": 80
      },
      {
        "name": "selected",
        "type": "boolean",
        "required": false
      },
      {
        "name": "disabled",
        "type": "boolean",
        "required": false
      },
      {
        "name": "notification",
        "type": "boolean",
        "required": false
      }
    ],
    "inputs": [],
    "outputs": [],
    "slots": [],
    "states": [
      "ready",
      "disabled"
    ],
    "actions": [],
    "accessibility": {
      "role": "img",
      "keyboard": "Native controls provide keyboard operation, visible focus, names, and disabled or busy semantics."
    },
    "provenance": {
      "source": "Agent Factory inline inventory; geometry redrawn as reusable React SVG",
      "license": "Project-owned"
    },
    "example": {
      "label": "문서"
    }
  },
  {
    "id": "workspace@1",
    "kind": "icon",
    "allowedRegions": [
      "task-list"
    ],
    "properties": [
      {
        "name": "label",
        "type": "string",
        "required": true,
        "maxLength": 80
      },
      {
        "name": "selected",
        "type": "boolean",
        "required": false
      },
      {
        "name": "disabled",
        "type": "boolean",
        "required": false
      },
      {
        "name": "notification",
        "type": "boolean",
        "required": false
      }
    ],
    "inputs": [],
    "outputs": [],
    "slots": [],
    "states": [
      "ready",
      "disabled"
    ],
    "actions": [],
    "accessibility": {
      "role": "img",
      "keyboard": "Native controls provide keyboard operation, visible focus, names, and disabled or busy semantics."
    },
    "provenance": {
      "source": "Agent Factory inline inventory; geometry redrawn as reusable React SVG",
      "license": "Project-owned"
    },
    "example": {
      "label": "작업공간"
    }
  },
  {
    "id": "knowledge@1",
    "kind": "icon",
    "allowedRegions": [
      "task-list"
    ],
    "properties": [
      {
        "name": "label",
        "type": "string",
        "required": true,
        "maxLength": 80
      },
      {
        "name": "selected",
        "type": "boolean",
        "required": false
      },
      {
        "name": "disabled",
        "type": "boolean",
        "required": false
      },
      {
        "name": "notification",
        "type": "boolean",
        "required": false
      }
    ],
    "inputs": [],
    "outputs": [],
    "slots": [],
    "states": [
      "ready",
      "disabled"
    ],
    "actions": [],
    "accessibility": {
      "role": "img",
      "keyboard": "Native controls provide keyboard operation, visible focus, names, and disabled or busy semantics."
    },
    "provenance": {
      "source": "Agent Factory inline inventory; geometry redrawn as reusable React SVG",
      "license": "Project-owned"
    },
    "example": {
      "label": "지식"
    }
  },
  {
    "id": "connections@1",
    "kind": "icon",
    "allowedRegions": [
      "task-list"
    ],
    "properties": [
      {
        "name": "label",
        "type": "string",
        "required": true,
        "maxLength": 80
      },
      {
        "name": "selected",
        "type": "boolean",
        "required": false
      },
      {
        "name": "disabled",
        "type": "boolean",
        "required": false
      },
      {
        "name": "notification",
        "type": "boolean",
        "required": false
      }
    ],
    "inputs": [],
    "outputs": [],
    "slots": [],
    "states": [
      "ready",
      "disabled"
    ],
    "actions": [],
    "accessibility": {
      "role": "img",
      "keyboard": "Native controls provide keyboard operation, visible focus, names, and disabled or busy semantics."
    },
    "provenance": {
      "source": "Agent Factory inline inventory; geometry redrawn as reusable React SVG",
      "license": "Project-owned"
    },
    "example": {
      "label": "연동"
    }
  },
  {
    "id": "jobs@1",
    "kind": "icon",
    "allowedRegions": [
      "task-list"
    ],
    "properties": [
      {
        "name": "label",
        "type": "string",
        "required": true,
        "maxLength": 80
      },
      {
        "name": "selected",
        "type": "boolean",
        "required": false
      },
      {
        "name": "disabled",
        "type": "boolean",
        "required": false
      },
      {
        "name": "notification",
        "type": "boolean",
        "required": false
      }
    ],
    "inputs": [],
    "outputs": [],
    "slots": [],
    "states": [
      "ready",
      "disabled"
    ],
    "actions": [],
    "accessibility": {
      "role": "img",
      "keyboard": "Native controls provide keyboard operation, visible focus, names, and disabled or busy semantics."
    },
    "provenance": {
      "source": "Agent Factory inline inventory; geometry redrawn as reusable React SVG",
      "license": "Project-owned"
    },
    "example": {
      "label": "작업"
    }
  },
  {
    "id": "audit@1",
    "kind": "icon",
    "allowedRegions": [
      "task-list"
    ],
    "properties": [
      {
        "name": "label",
        "type": "string",
        "required": true,
        "maxLength": 80
      },
      {
        "name": "selected",
        "type": "boolean",
        "required": false
      },
      {
        "name": "disabled",
        "type": "boolean",
        "required": false
      },
      {
        "name": "notification",
        "type": "boolean",
        "required": false
      }
    ],
    "inputs": [],
    "outputs": [],
    "slots": [],
    "states": [
      "ready",
      "disabled"
    ],
    "actions": [],
    "accessibility": {
      "role": "img",
      "keyboard": "Native controls provide keyboard operation, visible focus, names, and disabled or busy semantics."
    },
    "provenance": {
      "source": "Agent Factory inline inventory; geometry redrawn as reusable React SVG",
      "license": "Project-owned"
    },
    "example": {
      "label": "감사"
    }
  },
  {
    "id": "calendar@1",
    "kind": "icon",
    "allowedRegions": [
      "task-list"
    ],
    "properties": [
      {
        "name": "label",
        "type": "string",
        "required": true,
        "maxLength": 80
      },
      {
        "name": "selected",
        "type": "boolean",
        "required": false
      },
      {
        "name": "disabled",
        "type": "boolean",
        "required": false
      },
      {
        "name": "notification",
        "type": "boolean",
        "required": false
      }
    ],
    "inputs": [],
    "outputs": [],
    "slots": [],
    "states": [
      "ready",
      "disabled"
    ],
    "actions": [],
    "accessibility": {
      "role": "img",
      "keyboard": "Native controls provide keyboard operation, visible focus, names, and disabled or busy semantics."
    },
    "provenance": {
      "source": "Agent Factory inline inventory; geometry redrawn as reusable React SVG",
      "license": "Project-owned"
    },
    "example": {
      "label": "일정"
    }
  },
  {
    "id": "agents@1",
    "kind": "icon",
    "allowedRegions": [
      "task-list"
    ],
    "properties": [
      {
        "name": "label",
        "type": "string",
        "required": true,
        "maxLength": 80
      },
      {
        "name": "selected",
        "type": "boolean",
        "required": false
      },
      {
        "name": "disabled",
        "type": "boolean",
        "required": false
      },
      {
        "name": "notification",
        "type": "boolean",
        "required": false
      }
    ],
    "inputs": [],
    "outputs": [],
    "slots": [],
    "states": [
      "ready",
      "disabled"
    ],
    "actions": [],
    "accessibility": {
      "role": "img",
      "keyboard": "Native controls provide keyboard operation, visible focus, names, and disabled or busy semantics."
    },
    "provenance": {
      "source": "Agent Factory inline inventory; geometry redrawn as reusable React SVG",
      "license": "Project-owned"
    },
    "example": {
      "label": "에이전트"
    }
  },
  {
    "id": "logs@1",
    "kind": "icon",
    "allowedRegions": [
      "task-list"
    ],
    "properties": [
      {
        "name": "label",
        "type": "string",
        "required": true,
        "maxLength": 80
      },
      {
        "name": "selected",
        "type": "boolean",
        "required": false
      },
      {
        "name": "disabled",
        "type": "boolean",
        "required": false
      },
      {
        "name": "notification",
        "type": "boolean",
        "required": false
      }
    ],
    "inputs": [],
    "outputs": [],
    "slots": [],
    "states": [
      "ready",
      "disabled"
    ],
    "actions": [],
    "accessibility": {
      "role": "img",
      "keyboard": "Native controls provide keyboard operation, visible focus, names, and disabled or busy semantics."
    },
    "provenance": {
      "source": "Agent Factory inline inventory; geometry redrawn as reusable React SVG",
      "license": "Project-owned"
    },
    "example": {
      "label": "로그"
    }
  },
  {
    "id": "tests@1",
    "kind": "icon",
    "allowedRegions": [
      "task-list"
    ],
    "properties": [
      {
        "name": "label",
        "type": "string",
        "required": true,
        "maxLength": 80
      },
      {
        "name": "selected",
        "type": "boolean",
        "required": false
      },
      {
        "name": "disabled",
        "type": "boolean",
        "required": false
      },
      {
        "name": "notification",
        "type": "boolean",
        "required": false
      }
    ],
    "inputs": [],
    "outputs": [],
    "slots": [],
    "states": [
      "ready",
      "disabled"
    ],
    "actions": [],
    "accessibility": {